{
  "contract_version": "stock-brief-data-v1",
  "date": "2026-07-15",
  "generated_at": "2026-07-15T14:00:00-07:00",
  "kind": "stock",
  "quotes": [
    {
      "company": "Apple Inc.",
      "current_price": "$327.50",
      "daily_change": "+$12.64",
      "daily_change_percent": "+4.01%",
      "day_high": "$328.73",
      "day_low": "$317.32",
      "fifty_two_week_high": "$328.73",
      "fifty_two_week_low": "$201.50",
      "source_label": "Yahoo Finance",
      "source_url": "https://finance.yahoo.com/quote/AAPL",
      "ticker": "AAPL",
      "volume": "60,957,600"
    },
    {
      "company": "Amazon.com, Inc.",
      "current_price": "$254.96",
      "daily_change": "+$7.47",
      "daily_change_percent": "+3.02%",
      "day_high": "$256.48",
      "day_low": "$249.75",
      "fifty_two_week_high": "$278.56",
      "fifty_two_week_low": "$196.00",
      "source_label": "Yahoo Finance",
      "source_url": "https://finance.yahoo.com/quote/AMZN",
      "ticker": "AMZN",
      "volume": "45,240,600"
    },
    {
      "company": "NVIDIA Corporation",
      "current_price": "$212.50",
      "daily_change": "+$0.70",
      "daily_change_percent": "+0.33%",
      "day_high": "$213.81",
      "day_low": "$206.04",
      "fifty_two_week_high": "$236.54",
      "fifty_two_week_low": "$164.07",
      "source_label": "Yahoo Finance",
      "source_url": "https://finance.yahoo.com/quote/NVDA",
      "ticker": "NVDA",
      "volume": "124,797,200"
    },
    {
      "company": "Snap Inc.",
      "current_price": "$4.76",
      "daily_change": "+$0.08",
      "daily_change_percent": "+1.71%",
      "day_high": "$4.88",
      "day_low": "$4.74",
      "fifty_two_week_high": "$10.41",
      "fifty_two_week_low": "$3.81",
      "source_label": "Yahoo Finance",
      "source_url": "https://finance.yahoo.com/quote/SNAP",
      "ticker": "SNAP",
      "volume": "42,332,600"
    },
    {
      "company": "Alphabet Inc.",
      "current_price": "$370.92",
      "daily_change": "+$11.41",
      "daily_change_percent": "+3.17%",
      "day_high": "$373.65",
      "day_low": "$357.76",
      "fifty_two_week_high": "$408.61",
      "fifty_two_week_low": "$186.15",
      "source_label": "Yahoo Finance",
      "source_url": "https://finance.yahoo.com/quote/GOOGL",
      "ticker": "GOOGL",
      "volume": "28,284,600"
    },
    {
      "company": "Microsoft Corporation",
      "current_price": "$395.63",
      "daily_change": "+$10.70",
      "daily_change_percent": "+2.78%",
      "day_high": "$398.96",
      "day_low": "$386.40",
      "fifty_two_week_high": "$555.45",
      "fifty_two_week_low": "$349.20",
      "source_label": "Yahoo Finance",
      "source_url": "https://finance.yahoo.com/quote/MSFT",
      "ticker": "MSFT",
      "volume": "36,253,700"
    },
    {
      "company": "The Walt Disney Company",
      "current_price": "$97.15",
      "daily_change": "+$1.28",
      "daily_change_percent": "+1.34%",
      "day_high": "$97.90",
      "day_low": "$96.10",
      "fifty_two_week_high": "$123.40",
      "fifty_two_week_low": "$92.19",
      "source_label": "Yahoo Finance",
      "source_url": "https://finance.yahoo.com/quote/DIS",
      "ticker": "DIS",
      "volume": "10,219,200"
    }
  ],
  "timezone": "America/Los_Angeles"
}
