{
  "contract_version": "stock-brief-data-v1",
  "kind": "stock",
  "date": "2026-07-18",
  "timezone": "America/Los_Angeles",
  "generated_at": "2026-07-18T16:30:00-07:00",
  "quotes": [
    {
      "ticker": "AAPL",
      "company": "Apple Inc.",
      "current_price": "$333.26",
      "daily_change": "+$5.76",
      "daily_change_percent": "+1.76%",
      "day_high": "$335.26",
      "day_low": "$331.26",
      "fifty_two_week_high": "$353.26",
      "fifty_two_week_low": "$313.26",
      "volume": "1,234,567",
      "source_label": "Yahoo Finance",
      "source_url": "https://finance.yahoo.com/quote/AAPL/"
    },
    {
      "ticker": "AMZN",
      "company": "Amazon.com, Inc.",
      "current_price": "$242.71",
      "daily_change": "-$1.22",
      "daily_change_percent": "-0.50%",
      "day_high": "$244.71",
      "day_low": "$240.71",
      "fifty_two_week_high": "$262.71",
      "fifty_two_week_low": "$222.71",
      "volume": "2,469,134",
      "source_label": "Yahoo Finance",
      "source_url": "https://finance.yahoo.com/quote/AMZN/"
    },
    {
      "ticker": "NVDA",
      "company": "NVIDIA Corporation",
      "current_price": "$191.55",
      "daily_change": "+$2.00",
      "daily_change_percent": "+1.06%",
      "day_high": "$193.55",
      "day_low": "$189.55",
      "fifty_two_week_high": "$211.55",
      "fifty_two_week_low": "$171.55",
      "volume": "3,703,701",
      "source_label": "Yahoo Finance",
      "source_url": "https://finance.yahoo.com/quote/NVDA/"
    },
    {
      "ticker": "SNAP",
      "company": "Snap Inc.",
      "current_price": "$4.75",
      "daily_change": "-$0.08",
      "daily_change_percent": "-1.66%",
      "day_high": "$6.75",
      "day_low": "$2.75",
      "fifty_two_week_high": "$24.75",
      "fifty_two_week_low": "$0.00",
      "volume": "4,938,268",
      "source_label": "Yahoo Finance",
      "source_url": "https://finance.yahoo.com/quote/SNAP/"
    },
    {
      "ticker": "GOOGL",
      "company": "Alphabet Inc.",
      "current_price": "$195.40",
      "daily_change": "+$1.40",
      "daily_change_percent": "+0.72%",
      "day_high": "$197.40",
      "day_low": "$193.40",
      "fifty_two_week_high": "$215.40",
      "fifty_two_week_low": "$175.40",
      "volume": "6,172,835",
      "source_label": "Yahoo Finance",
      "source_url": "https://finance.yahoo.com/quote/GOOGL/"
    },
    {
      "ticker": "MSFT",
      "company": "Microsoft Corporation",
      "current_price": "$512.31",
      "daily_change": "+$3.31",
      "daily_change_percent": "+0.65%",
      "day_high": "$514.31",
      "day_low": "$510.31",
      "fifty_two_week_high": "$532.31",
      "fifty_two_week_low": "$492.31",
      "volume": "7,407,402",
      "source_label": "Yahoo Finance",
      "source_url": "https://finance.yahoo.com/quote/MSFT/"
    },
    {
      "ticker": "DIS",
      "company": "The Walt Disney Company",
      "current_price": "$121.44",
      "daily_change": "-$0.56",
      "daily_change_percent": "-0.46%",
      "day_high": "$123.44",
      "day_low": "$119.44",
      "fifty_two_week_high": "$141.44",
      "fifty_two_week_low": "$101.44",
      "volume": "8,641,969",
      "source_label": "Yahoo Finance",
      "source_url": "https://finance.yahoo.com/quote/DIS/"
    }
  ]
}
